{"$schema":"https://json-schema.org/draft/2020-12/schema","$id":"urn:harness:taskset.v1","type":"object","additionalProperties":false,"required":["schema","taskset_id","revision","cases","sha256"],"properties":{"schema":{"const":"harness.taskset.v1"},"taskset_id":{"type":"string","pattern":"^[A-Za-z0-9_.:-]{1,128}$"},"revision":{"type":"integer","minimum":1},"cases":{"type":"array","minItems":1,"items":{"type":"object","additionalProperties":false,"required":["case_id","revision","split","case_digest"],"properties":{"case_id":{"type":"string","pattern":"^[A-Za-z0-9_.:-]{1,128}$"},"revision":{"type":"integer","minimum":1},"split":{"enum":["training","development","holdout","canary","quarantine"]},"case_digest":{"type":"string","pattern":"^[0-9a-f]{64}$"}}}},"sha256":{"type":"string","pattern":"^[0-9a-f]{64}$"}}}
