{"schema":"harness.taskset.v1","taskset_id":"taskset_context_v1","revision":1,"cases":[{"case_id":"case_context_1","revision":1,"split":"development","case_digest":"aaaaaaaaaaaaaaaaaaaaaaaaaaaaaaaaaaaaaaaaaaaaaaaaaaaaaaaaaaaaaaaa"}],"sha256":"4c532aeddd61b4360d1c99d1d4c90b8b6533356145609bcf57ae194d99907c49"}
